{
  "schema_version": 2,
  "harness_policy_version": "0.5.0",
  "status": "accepted",
  "project": {
    "name": "local-first-example",
    "kind": "local-first-multi-client-application",
    "sensitive_data": true
  },
  "sources": {
    "agent_rules": "AGENTS.md",
    "architecture": "DESIGN.md",
    "work_tracker": "TODO.md",
    "compatibility": "compatibility_manifest.json",
    "acceptance_contracts": "docs/acceptance_contracts.json",
    "operator_interface": "./tool"
  },
  "capabilities": {
    "durable_work": true,
    "offline_operation": true,
    "replicated_state": true,
    "multiple_clients": true,
    "external_providers": true,
    "ai_mediated_actions": true,
    "generated_artifacts": true,
    "physical_devices": true,
    "shared_production_state": true,
    "artifact_publication": true,
    "mutable_authority_context": true,
    "event_delivery": true,
    "interactive_clients": true,
    "asynchronous_interactive_loading": true,
    "shared_nonpreemptible_storage": true,
    "constrained_runtime_resources": true,
    "multiple_adapters": true
  },
  "enforcement": {
    "canonical-authority": {
      "rung": "local_check",
      "owner": "DESIGN.md#ownership",
      "artifacts": ["test/semantic_parity_test.dart"]
    },
    "bounded-contracts": {
      "rung": "local_check",
      "owner": "docs/module_boundaries.json",
      "artifacts": ["test/module_boundaries_test.dart"]
    },
    "shared-semantics": {
      "rung": "fault_test",
      "owner": "lib/domain",
      "artifacts": ["test/semantic_parity_test.dart"]
    },
    "explicit-composition": {
      "rung": "local_check",
      "owner": "lib/composition_root.dart",
      "artifacts": ["test/composition_test.dart"]
    },
    "durable-admission": {
      "rung": "fault_test",
      "owner": "lib/durable_operation_repository.dart",
      "artifacts": ["test/durable_operation_replay_test.dart"]
    },
    "normal-failure-semantics": {
      "rung": "fault_test",
      "owner": "lib/durable_operation_policy.dart",
      "artifacts": ["test/durable_operation_replay_test.dart"]
    },
    "committed-event-truth": {
      "rung": "fault_test",
      "owner": "lib/material_event_outbox.dart",
      "artifacts": ["test/lost_notification_test.dart"]
    },
    "publication-classes": {
      "rung": "local_check",
      "owner": "lib/publication_event.dart",
      "artifacts": ["test/publication_class_test.dart"]
    },
    "coalesced-bounded-work": {
      "rung": "fault_test",
      "owner": "lib/durable_operation_scheduler.dart",
      "artifacts": ["test/coalescing_test.dart"]
    },
    "transient-presentation": {
      "rung": "local_check",
      "owner": "lib/screens",
      "artifacts": ["test/ui_dependency_test.dart"]
    },
    "useful-paint-graph": {
      "rung": "fault_test",
      "owner": "docs/useful_paint.json",
      "artifacts": ["test/useful_paint_test.dart"]
    },
    "persistence-qos": {
      "rung": "fault_test",
      "owner": "lib/database_scheduler.dart",
      "artifacts": ["test/database_contention_test.dart"]
    },
    "resource-admission-and-reclamation": {
      "rung": "runtime_guard",
      "owner": "lib/runtime_resource_governor.dart",
      "artifacts": ["test/runtime_resource_pressure_test.dart"]
    },
    "authority-context-fencing": {
      "rung": "fault_test",
      "owner": "lib/authorization_context.dart",
      "artifacts": ["test/authorization_context_test.dart"]
    },
    "representation-separation": {
      "rung": "owner",
      "owner": "DESIGN.md#representations",
      "artifacts": ["test/projection_rebuild_test.dart"]
    },
    "explicit-deletion": {
      "rung": "fault_test",
      "owner": "lib/tombstone_policy.dart",
      "artifacts": ["test/deletion_reconciliation_test.dart"]
    },
    "versioned-compatibility": {
      "rung": "ci_check",
      "owner": "compatibility_manifest.json",
      "artifacts": ["test/mixed_version_compatibility_test.dart"]
    },
    "typed-boundaries": {
      "rung": "local_check",
      "owner": "lib/domain_types.dart",
      "artifacts": ["test/boundary_validation_test.dart"]
    },
    "discoverable-operations": {
      "rung": "ci_check",
      "owner": "./tool",
      "artifacts": ["test/operator_registry_test.dart"]
    },
    "separate-action-authority": {
      "rung": "runtime_guard",
      "owner": "./tool",
      "artifacts": ["test/operator_authorization_test.dart"]
    },
    "typed-exact-evidence": {
      "rung": "ci_check",
      "owner": "docs/acceptance_contracts.json",
      "artifacts": ["scripts/acceptance_contracts.dart"]
    },
    "privacy-lifecycle": {
      "rung": "fault_test",
      "owner": "lib/privacy_lifecycle.dart",
      "artifacts": ["test/privacy_lifecycle_test.dart"]
    },
    "open-world-assurance": {
      "rung": "audit",
      "owner": "docs/security_privacy_review.md"
    }
  },
  "exceptions": []
}
