{
  "schema_version": 2,
  "harness_policy_version": "0.3.2",
  "status": "accepted",
  "project": {
    "name": "small-example",
    "kind": "single-process-application",
    "sensitive_data": false
  },
  "sources": {
    "agent_rules": "AGENTS.md",
    "architecture": "README.md",
    "operator_interface": "package.json"
  },
  "capabilities": {
    "durable_work": false,
    "offline_operation": false,
    "replicated_state": false,
    "multiple_clients": false,
    "external_providers": false,
    "ai_mediated_actions": false,
    "generated_artifacts": false,
    "physical_devices": false,
    "shared_production_state": false,
    "artifact_publication": false,
    "mutable_authority_context": false,
    "event_delivery": false,
    "interactive_clients": false,
    "asynchronous_interactive_loading": false,
    "shared_nonpreemptible_storage": false,
    "multiple_adapters": false
  },
  "enforcement": {
    "canonical-authority": {
      "rung": "owner",
      "owner": "src/application.ts",
      "artifacts": ["test/application.test.ts"]
    },
    "bounded-contracts": {
      "rung": "local_check",
      "owner": "package.json#scripts.test",
      "artifacts": ["test/application.test.ts"]
    }
  },
  "exceptions": []
}
